{
  "schema": 1,
  "id": "protocol-minimal",
  "title": "最小合法学习包",
  "groups": [
    {
      "id": "g1",
      "title": "第一组 · 只有必填字段",
      "priority": "P1",
      "stage": 1,
      "checks": [
        { "id": "g1.1", "text": "这条只有必填字段，没有要点也没有易错", "lvl": "P1" },
        { "id": "g1.2", "text": "这条也没有任何问答覆盖它", "lvl": "P2" }
      ]
    }
  ],
  "qas": [
    {
      "id": "q.min.only",
      "m": "g1",
      "lvl": "P1",
      "layer": 1,
      "q": "只有必填字段的问答长什么样？",
      "covers": ["g1.1"],
      "ans": [{ "h": "结论", "p": "能渲染就是全部要求。" }]
    }
  ]
}
