{
  "schema": 1,
  "id": "demo",
  "title": "题台 · 示例包",
  "subtitle": "用来试多包切换的最小学习包",
  "groups": [
    {
      "id": "d1",
      "title": "示例组 · 认识题台",
      "short": "示例",
      "priority": "P0",
      "stage": 1,
      "signal": "这个包只用来验证「多个学习包共存、各有各的进度」是否好用，内容本身没有复习价值。",
      "keypoints": [
        "每个学习包都有自己的进度文件，切换不会互相覆盖",
        "内置包不能删，导入的包可以随时删掉",
        "换包后底部导航、筛选、刷题池都跟着换"
      ],
      "traps": [
        "以为换包会丢进度——其实各存各的",
        "在示例包里刷题，进度只在示例包里"
      ],
      "checks": [
        { "id": "d1.1", "text": "学习包之间是怎么隔离进度的？", "lvl": "P0" },
        { "id": "d1.2", "text": "内置包和导入包有什么区别？", "lvl": "P1" }
      ]
    }
  ],
  "qas": [
    {
      "id": "q.demo.isolate",
      "m": "d1",
      "lvl": "P0",
      "layer": 2,
      "q": "两个学习包里都有 m1.1，进度会串吗？",
      "tags": ["多包", "进度"],
      "covers": ["d1.1"],
      "next": ["q.demo.builtin"],
      "ans": [
        { "h": "一句话", "p": "不会串。进度按**学习包 id** 分文件存，`m1.1` 只在它所属的那个包里成立。" },
        { "h": "为什么不会串", "p": "应用私有目录下每个包一份 `states/<id>.json`，切包时先把当前包落盘、再读目标包那份；同名知识点只是两条互不相干的记录。" },
        { "h": "什么时候会出事", "p": "两种情况：把两个包写成同一个 `id`（后导入的会覆盖前者的进度文件）；或者手工拷贝 `states/` 时改错了文件名。" },
        { "h": "怎么验证", "p": "下载一个包 → 切成它 → 刷两题 → 切回原包，两边的百分比应当互不影响；再切回新包，进度还在。" }
      ]
    },
    {
      "id": "q.demo.builtin",
      "m": "d1",
      "lvl": "P1",
      "layer": 2,
      "q": "内置包和导入包有什么区别？",
      "tags": ["多包"],
      "covers": ["d1.2"],
      "peer": ["q.demo.isolate"],
      "ans": [
        { "h": "一句话", "p": "内置包随 APK 打包、删不掉；导入包是普通文件，随时能删，也能被同 id 的新文件覆盖。" },
        { "h": "关键差异", "p": "两种包在应用里几乎一样用，差在三件事：", "list": [
          "存放位置：内置读 `assets/decks/`（只读），导入写应用私有目录的 `decks/`",
          "生命周期：内置跟着 APK 走，卸载才消失；导入可删、可换",
          "优先级：同 id 时导入的覆盖内置的"
        ] },
        { "h": "怎么选", "p": "内容会迭代、或者想发给别人用，就做成导入包；只有「这个 App 必须自带」的底子内容才打进 APK。" },
        { "h": "边界", "p": "内置包删不掉，也不该用来放个人笔记——凡是以后可能想撤掉、想换掉的内容，一律走导入。" }
      ]
    }
  ]
}
